{
    "$id": "/data/equipment.pt-BR.json",
    "title": "Equipamentos",
    "version": "1.1.0",
    "author": "Hendo",
    "description": "Equipamentos do Livro Básico de Cyberpunk 2020, com as extensões existentes do site preservadas.",
    "type": "object",
    "data": {
        "fashion": {
            "name": "Moda",
            "description": "Os estilos de roupa de 2020 podem ser reduzidos a cinco manifestações básicas da moda.",
            "modifiers": {
                "Roupa Normal Elegante": "1x",
                "Roupa Esporte": "2x",
                "Roupas Formais": "3x",
                "Alta Costura": "4x",
                "Moda Urbana": "2x"
            },
            "types": {
                "Roupa Normal Elegante": "A roupa padrão das ruas, confeccionada com componentes modulares coloridos. Predominam cintos, casacos, faixas e botas.",
                "Roupa Esporte": "O equivalente à moda esportiva do século XXI: roupas acolchoadas, com logotipos esportivos ou de Corporações.",
                "Roupas Formais": "O equivalente ao terno: cores austeras, prendedores de gravata e sapatos de couro legítimo. Lã e outros tecidos naturais são apropriados para Corporativos promissores.",
                "Alta Costura": "Roupas sofisticadas e caras para as classes superiores, com grifes como Miyake, Si-fui Yan e Anne Calvin.",
                "Moda Urbana": "Videojaquetas, tecidos que mudam de cor, camuflagem, couro, tachas, logotipos, jeans, saias de couro e botas: o lado mais selvagem da cibermoda."
            },
            "list": {
                "pants": {
                    "name": "Calças",
                    "price": "20.0",
                    "note": "aplica-se o modificador de estilo"
                },
                "top": {
                    "name": "Top",
                    "price": "15.0",
                    "note": "aplica-se o modificador de estilo"
                },
                "jacket": {
                    "name": "Jaqueta",
                    "price": "35.0",
                    "note": "aplica-se o modificador de estilo"
                },
                "footwear": {
                    "name": "Calçados",
                    "price": "25.0",
                    "note": "aplica-se o modificador de estilo"
                },
                "accessory": {
                    "name": "Joias",
                    "price": "entre 10.0 e 100.0",
                    "note": "aplica-se o modificador de estilo"
                },
                "mirrorshades": {
                    "name": "Óculos Espelhados",
                    "price": "entre 5.0 e 50.0",
                    "note": "aplica-se o modificador de estilo"
                },
                "contactlenses": {
                    "name": "Lentes de Contato",
                    "price": "100.0",
                    "note": "aplica-se o modificador de estilo"
                },
                "glasses": {
                    "name": "Óculos",
                    "price": "50.0",
                    "note": "aplica-se o modificador de estilo"
                }
            }
        },
        "tools": {
            "name": "Ferramentas",
            "description": "Ferramentas",
            "list": {
                "techscanner": {
                    "name": "Tecscanner",
                    "price": "600.0",
                    "description": "Um pequeno microcomputador de mão com vários conectores de entrada e saída e sondas. Executa programas de diagnóstico, identifica e examina componentes defeituosos e mostra esquemas internos numa pequena tela."
                },
                "cuttingtorch": {
                    "name": "Maçarico",
                    "price": "40.0",
                    "description": "O maçarico comum de oxiacetileno, portátil e com cerca de 30 cm. Modelos mais potentes, inclusive lanças de termite, custam entre 5 e 15 vezes o preço normal."
                },
                "techToolkit": {
                    "name": "Kit de Ferramentas",
                    "price": "100.0",
                    "description": "Um conjunto de ferramentas diversas para reparar objetos mecânicos, geralmente guardado numa maleta de 10 por 40 por 5 cm."
                },
                "breakingEnteringTools": {
                    "name": "Ferramentas B&E",
                    "price": "120.0"
                },
                "eletronicToolkit": {
                    "name": "Kit de Ferramentas Eletrônicas",
                    "price": "100.0",
                    "description": "Um conjunto de ferramentas diversas para reparar equipamentos eletrônicos."
                },
                "protectiveGoggles": {
                    "name": "Óculos de Proteção",
                    "price": "20.0",
                    "description": "Proteção para os olhos durante soldagem, trabalho com metais, mistura de produtos químicos e atividades semelhantes."
                },
                "flashtube": {
                    "name": "Lanterna",
                    "price": "2.0",
                    "description": "Uma lanterna comum com alcance entre 30 e 35 metros. Lanternas de bolso com um quarto do alcance custam metade do preço normal."
                },
                "glowstick": {
                    "name": "Bastão de Luz",
                    "price": "1.0",
                    "description": "Composto químico luminoso num tubo plástico de 15 cm. Sacuda ou quebre para ativar. A luz suave dura até seis horas e pode ser verde, azul ou vermelha."
                },
                "flashpaint": {
                    "name": "Tinta Luminosa",
                    "price": "10.0",
                    "note": "por pinta (0,47 L)",
                    "description": "Tinta fluorescente que emite uma luz suave equivalente à de um Bastão de Luz e dura até quatro horas."
                },
                "flashtape": {
                    "name": "Fita Luminosa",
                    "price": "10.0",
                    "note": "por pé (0,30 m)",
                    "description": "O mesmo material da Tinta Luminosa, em forma de fita. Dura seis horas e existe em várias larguras."
                },
                "rope": {
                    "name": "Corda",
                    "price": "2.0",
                    "note": "por pé (0,30 m)",
                    "description": "Fibras sintéticas trançadas em várias grossuras e pesos. Suporta até 450 kg."
                },
                "breathmask": {
                    "name": "Máscara de Pintor",
                    "price": "30.0",
                    "description": "Máscara comum de pintor que cobre boca e nariz, com dois filtros laterais substituíveis. Um pacote com dez filtros custa 1 eb. Boa para evitar a fumaça e a poluição."
                }
            }
        },
        "personalElectronics": {
            "name": "Eletrônicos Pessoais",
            "description": "Eletrônicos Pessoais",
            "list": {
                "hologen": {
                    "name": "Gerador de Holografia",
                    "price": "500.0",
                    "description": "Uma pequena caixa, com cerca de 10 por 5 por 15 cm, que projeta uma imagem holográfica a partir de um chip substituível. Aceita chips da maioria das câmeras digitais e pode ser conectada a um gravador/reprodutor digital."
                },
                "videoBoard": {
                    "name": "Monitor de Vídeo",
                    "price": "100.0",
                    "note": "por pé quadrado (0,093 m²)",
                    "description": "Monitor de tela plana com tecnologia de cristal líquido. Tem no máximo 2,5 cm de espessura e conectores para servir de monitor a outros aparelhos; os modelos grandes são usados como painéis publicitários."
                },
                "dataChip": {
                    "name": "Datachip",
                    "price": "10.0",
                    "description": "O meio de armazenamento do futuro. Normalmente envoltos em plástico, os chips podem ter forma de botões, quadrados achatados ou lascas triangulares; adaptadores permitem que qualquer gravador leia qualquer formato."
                },
                "logcompass": {
                    "name": "Logbússola",
                    "price": "50.0",
                    "description": "Uma bússola inercial programável que registra mudanças de direção a partir de um ponto e de um rumo estabelecidos."
                },
                "digitalRecorder": {
                    "name": "Gravador Digital",
                    "price": "300.0",
                    "description": "Aparelho de gravação de áudio baseado em datachips. A maioria tem o tamanho de dois livros de bolso empilhados, embora alguns sejam menores que um maço de cartas."
                },
                "digitalCamera": {
                    "name": "Câmera Digital",
                    "price": "150.0",
                    "description": "Digitaliza imagens estáticas e as armazena num cartucho de chip. Tem o tamanho aproximado de um maço de cigarros."
                },
                "videoCam": {
                    "name": "Vídeo Câmera",
                    "price": "800.0",
                    "description": "Pode ser instalada na cabeça, no ombro ou usada com as mãos. Som e imagem são gravados numa fita compacta ou transmitidos diretamente por cabos. O preço indicado corresponde ao modelo de ombro mais barato."
                },
                "tapePlayer": {
                    "name": "Toca-Fitas de Áudio/Vídeo",
                    "price": "40.0",
                    "description": "Reproduz fitas de Vídeo Câmera e muitas fitas antigas de áudio."
                },
                "tape": {
                    "name": "Fita de Vídeo",
                    "price": "4.0",
                    "description": "Meio digital de alta densidade capaz de armazenar sinais de áudio e imagens."